company_name,website,state,sector,capex_millions,notes
LIS Technologies,,Tennessee,Energy/Nuclear,1380,Laser uranium enrichment; $1.38B
Heil Trailer International,,Tennessee,Advanced Mfg,9.8,Trailer manufacturing expansion
ALUKO Group,,Tennessee,Advanced Mfg,110,Second US facility
Korea Zinc,,Tennessee,Metals,6600,First US operations; Korean FDI; MASSIVE
CDF Distributors,,Tennessee,Advanced Mfg,26,Relocating HQ to TN
Carlex Glass America,,Tennessee,Advanced Mfg,55,Glass manufacturing expansion
Hyosung HICO,,Tennessee,Grid/Transformers,150,Korean transformer maker; 2nd expansion in 6 months!
Anatolia Cabinet,,Tennessee,Advanced Mfg,10,New manufacturing facility
Aqua Membranes,,Tennessee,Advanced Mfg,6.5,Water filtration membranes; new TN presence
Biederman,,Tennessee,Advanced Mfg,4.4,First US location
Radiant,,Tennessee,Energy/Nuclear,280,World's first mass-produced nuclear generator factory!
Nidec,,Tennessee,Advanced Mfg,50,Japanese motor manufacturer expansion
BWXT Nuclear Fuel Services,bwxt.com,Tennessee,Energy/Nuclear/Defense,122,Nuclear fuel for naval defense; since 1950s
Microtex Composites,,Tennessee,Advanced Mfg,3.8,Italian; first US facility; automotive/aerospace composites
Samsung,samsung.com,Texas,Semiconductors,4730,2nm chips; $250M TSIF grant
Scotiabank,scotiabank.com,Texas,Financial Services,60,Canadian bank; regional office; $10.7M TEF
Prysmian/Encore Wire,,Texas,Grid/Wire,500,Italian; copper wire/cable expansion - GRID
Bridor USA,bridor.com,Texas,Food,410,French-Canadian; industrial bakery
GCP Paper,,Texas,Advanced Mfg,400,Tissue manufacturing
Ferrovial,,Texas,Energy/Solar,355,Spanish; 250MW solar; 450 GWh annually
SpaceX,https://spacex.com,Texas,Aerospace/Semiconductors,280,Semiconductor R&D; $17.3M TSIF grant
Vantage Data Centers,,Texas,Data Center,272,Hyperscale data center
NNA Polymers,,Texas,Chemicals,250,Water-soluble polymers; oilfield
SPC Group,spcgroup.co.kr,Texas,Food,208,Korean; Paris Baguette bakery
Ninth Avenue Foods,ninthavefoods.com,Texas,Food,200,Dairy; 3rd facility
MGC Pure Chemicals,mgc.co.jp,Texas,Semiconductors,150,Japanese; $5.3M TSIF grant
Applied Optoelectronics,,Texas,Tech/Data Center,150,Optical transceivers for AI
Formosa Plastics,,Texas,Chemicals,150,Taiwanese; C6 feedstock
MTU Aero Engines,mtu.de,Texas,Aerospace,120,German; jet engine expansion
E-Space,,Texas,Aerospace/Space,115,Satellite HQ and manufacturing
Linde,linde.com,Texas,Chemicals,100,Irish; industrial gas; SpaceX supplier
Bionova,,Texas,Life Sciences,100,Cell manufacturing
Select Water/Mariana Minerals,,Texas,Energy/Lithium,100,Lithium extraction plant
Inventec,inventec.com,Texas,Tech,85,Taiwanese; AI server manufacturing
Embraer,embraer.com,Texas,Aerospace,70,Brazilian; MRO facility
Rowan Digital,,Texas,Data Center,700,Hyperscale data center
MGM/VanTran Transformers,gm.com,Texas,Grid/Transformers,,430K sqft facility - GRID PLAY
Salcomp,salcomp.com,Texas,Tech,,Finnish; mobile power supplies; US HQ
L&T Technology,ltts.com,Texas,Tech,,Indian; engineering design center
Lefko,,Texas,Advanced Mfg,15,First US facility; $968K TEF
NTxBio,,Texas,Life Sciences,31,Biomanufacturing; $1.48M TEF
PEGATRON,pegatron.com,Texas,Tech,35,Taiwanese; AI computing; first US facility
Gattefossé,,Texas,Life Sciences,55,French; beauty/pharma ingredients
Gerdau,,Texas,Advanced Mfg,51,Brazilian; steel recycling expansion
BMK Pharma,,Texas,Life Sciences,50,US HQ; pharmaceutical
Yerico Manufacturing,yerico.com,Texas,Semiconductors,13,Semiconductor equipment refurb; $1.3M TSIF
Cancoil USA,,Texas,Industrial Mfg,,First US operations center
Ariat International,,Texas,Consumer/Apparel,9,Regional HQ expansion
Innovative Labs,,Utah,Life Sciences,,CDMO; health and wellness manufacturing
Bridor,bridor.com,Utah,Food,229,French-Canadian; bakery; 13-year plan
MCM Engineering II,,Utah,Grid/Switchgear,168,Custom MV/LV switchgear; 10-year plan - GRID!
Holtec/Hi Tech Solutions,,Utah,Nuclear/SMR Mfg,,Operation Gigawatt; SMR component manufacturing; workforce training
BAE Systems,https://www.baesystems.com/,Utah,Defense/Aerospace,,UK; new office; ICBM support
Ionic Mineral Technologies,,Utah,Critical Minerals,,Silicon Ridge project; rare earth; $29M Series B
Integrated Rail & Resources,,Utah,Rail/Resources,87,Railway and resource expansion
Solstice Advanced Materials,,Virginia,Advanced Materials,220,$2M performance grant; $1.5M Opportunity Fund
Infinity Global,,Virginia,Advanced Mfg,34,Packaging solutions; HQ expansion
Anchor,,Virginia,Defense/Maritime,,Maritime and defense expansion
Echodyne,,Washington,Defense/Radar,40,86K sq ft facility; radar production; summer 2026
Frontieras North America,,West Virginia,Energy/Clean Coal,850,Advanced coal reformation facility; 183 acres; 2000+ construction jobs
Calpine,,West Virginia,Energy/Natural Gas,1000,Natural gas power plant; Constellation unit
Microsoft,microsoft.com,Wisconsin,Data Center/AI,13300,15 new data centers; two campuses; massive AI expansion
Nestle Purina,purina.com,Wisconsin,Food,335,Swiss; pet food expansion; 35K sq ft
Foxconn,foxconn.com,Wisconsin,Tech,569,Taiwanese; expansion; new WEDC deal
Milwaukee Tool,,Wisconsin,Advanced Mfg,42,Power tools expansion; high-skill jobs
Catalent,,Wisconsin,Life Sciences,45,Biohealth facility expansion
"Enerpac Tool Group, Corp.",enerpac.com,Wisconsin,Manufacturing,15.7,Business Development Tax Credit
Cascades Holding US Inc.,cascades.com,Wisconsin,Manufacturing,6,Business Development Tax Credit
"Furlani Foods, LLC",furlani.com,Wisconsin,Manufacturing,43.5,Business Development Tax Credit
Microbial Discovery Group,microbialdg.com,Wisconsin,Manufacturing,28,Business Development Tax Credit
Vermilion Madison Development LLC,eveairmobility.com,Wisconsin,Construction,92.4,Brownfield Redevelopment Financial Assistance
"XeteX, LLC",,Wisconsin,Manufacturing,7.8,Business Development Tax Credit
"Associated Milk Producers, Inc.",oci-global.com,Wisconsin,Manufacturing,45.5,Business Development Tax Credit
"Reinhart FoodService, LLC",,Wisconsin,Wholesale Trade,14,Business Development Tax Credit
"Schutz Container Systems, Inc.",,Wisconsin,Manufacturing,166,Business Development Tax Credit
"WHPC-Regent Street-Madison, LLC",,Wisconsin,Construction,14.5,Brownfield Redevelopment Financial Assistance
Meta House Inc.,meta.com,Wisconsin,Health Care,26.3,Brownfield Redevelopment Financial Assistance
Kin at Freshwater LLC,,Wisconsin,Construction,43.8,Brownfield Redevelopment Financial Assistance
Big Lift LLC,,Wisconsin,Wholesale Trade,6.7,Business Development Tax Credit
"Dynamic Ratings, Inc.",,Wisconsin,Manufacturing,19.4,Business Development Tax Credit
"Urnex Brands, LLC",,Wisconsin,Manufacturing,10.6,Business Development Tax Credit
"Worthington Cylinders Wisconsin, LLC",linde.com,Wisconsin,Manufacturing,57.5,Business Development Tax Credit
"AmeriLux International, LLC",,Wisconsin,Manufacturing,42.7,Business Development Tax Credit
"Four South Blair, LLC",,Wisconsin,Construction,14.5,Brownfield Redevelopment Financial Assistance
"Degas, LLC",,Wisconsin,Info and Comm,100,Data Center Sales and Use Tax Exemption
"FIT Investment Group, LLC",,Wisconsin,Construction,18.4,Brownfield Redevelopment Financial Assistance
Kitchen Fresh Foods LLC,,Wisconsin,Manufacturing,6.5,Business Development Tax Credit
Triangle Manufacturing Company,,Wisconsin,Manufacturing,6.4,Business Development Tax Credit
"Impact Seven, Inc.",eveairmobility.com,Wisconsin,Health Care,17.7,Community Development Investment
"New Richmond, City of",,Wisconsin,Construction,24.4,Idle Sites Redevelopment Program
"Catalent Pharma Solutions, LLC",,Wisconsin,Manufacturing,45,Business Development Tax Credit
Swiss-Tech LLC,,Wisconsin,Manufacturing,2.8,Business Development Tax Credit
"Edgerton, City of",,Wisconsin,Construction,10.3,Idle Sites Redevelopment Program
"Oshkosh, City of",,Wisconsin,Health Care,11.2,Community Development Investment
"USV 222, LLC",,Wisconsin,Real Estate,50,Historic Preservation Tax Credit
Brearly Street Property Group LLC,,Wisconsin,Construction,25.4,Brownfield Redevelopment Financial Assistance
"Couleecap, Inc.",,Wisconsin,Real Estate,17.7,Community Development Investment
"South Milwaukee, City of",,Wisconsin,Public Admin,32.7,Idle Sites Redevelopment Program
"Wixon, Inc.",,Wisconsin,Manufacturing,22.2,Business Development Tax Credit
NOVA GB SPE LLC,,Wisconsin,Real Estate,76.5,Brownfield Redevelopment Financial Assistance
Kenosha Downtown Block I LLC,dow.com,Wisconsin,Real Estate,42.6,Brownfield Redevelopment Financial Assistance
"Yaskawa America, Inc",yaskawa.com,Wisconsin,Manufacturing,130,Enterprise Zone
2510 Good Hope LLC,,Wisconsin,Real Estate,50.9,Brownfield Redevelopment Financial Assistance
"La Crosse, City of",,Wisconsin,Public Admin,60.7,Idle Sites Redevelopment Program
Balcan USA Inc.,,Wisconsin,Manufacturing,68,Business Development Tax Credit
LAG Family LLC,,Wisconsin,Accommodation,11.8,Historic Preservation Tax Credit
Belmark Inc,,Wisconsin,Manufacturing,121.8,Business Development Tax Credit
"PS Seasoning & Spices, Inc.",,Wisconsin,Manufacturing,4.2,Business Development Tax Credit
Eli Lilly and Company,lilly.com,Wisconsin,Manufacturing,2232.7,Enterprise Zone
Stanpac USA LLC,,Wisconsin,Manufacturing,4.4,Business Development Tax Credit
"The DeLong Company, Inc.",,Wisconsin,Wholesale Trade,28,Business Development Tax Credit
"Derse, Inc",,Wisconsin,Manufacturing,48,Business Development Tax Credit
"Children's Museum of Rock County, Inc.",,Wisconsin,Recreation,14.8,Community Development Investment
"Impact Confections, Inc",,Wisconsin,Manufacturing,12.4,Business Development Tax Credit
Apple/Corning,corning.com,Kentucky,Tech/Advanced Mfg,2500,ALL iPhone & Apple Watch cover glass; 50% workforce increase
Samsung Electronics,samsung.com,Texas,Semiconductors,17000,Korean; CHIPS Act $4.7B; operational 2026
Stellantis,stellantis.com,Multiple,Automotive,13000,Dutch; Warren Truck + Detroit Assembly + Jeep; 50% production increase
Tesla,tesla.com,Nevada,Automotive/EV,3600,Semi-trucks and batteries
Sweetwater,,Indiana,Distribution,36.7,Music equipment distribution expansion
DDP Specialty Electronic Materials,,Michigan,Chemicals/Electronics,20,Electronic-grade specialty materials
E-Space Inc,,Texas,Aerospace/Space,115,Satellite manufacturing; 480K sq ft
Rowan Digital Infrastructure,,Texas,Data Center,700,Hyperscale data center
Lollicup USA,,Texas,Manufacturing,20,HQ relocation from CA; 650K sq ft
Hennessey,hennesseyperformance.com,Texas,Automotive,15,Car modification; 100K sq ft
Tubefab,,Texas,Manufacturing,30,Copper tube fabricator; 100K sq ft
AeroVironment,,Utah,Aerospace/Defense,,Drone/UAS manufacturer expansion
Edwards Lifesciences,,Utah,Life Sciences,,Medical devices
Fervo Energy,,Utah,Energy/Geothermal,,Geothermal power plant
Nucor,nucor.com,Utah,Steel,,Steel expansion
ContiTech USA,,Iowa,Manufacturing/Rubber,65,German (Continental AG); new location; rubber manufacturing
